{
  "schema_version": "0.1.0",
  "protocol_version": "0.1.0",
  "evaluation_id": "eval-listening-001",
  "package_id": "pkg-listening-detail-001",
  "package_hash": "sha256:7caf33441011ee2432fd8bbdb06258704eb20b56fccf2df798a36102381d367b",
  "content_hash": "sha256:bacc068688199b76075812b9f441be906bd686c2f97f5515526b43cbff715c2d",
  "entries": [
    {
      "activity_id": "act-answer",
      "scoring_rule": "normalized_text_set",
      "correct_option_ids": [],
      "accepted_texts": [
        "10:15 east entrance",
        "ten fifteen beside the east entrance"
      ],
      "expected_order": [],
      "expected_pairs": [],
      "integrity_ref": "sha256:f7b9cd202b5449fe75d31dc0bbc36417db0efdd5ca624f7fade7910896543752"
    }
  ]
}
