{
  "schema_version": "0.1.0",
  "protocol_version": "0.1.0",
  "evaluation_id": "eval-reading-001",
  "package_id": "pkg-reading-tfng-001",
  "package_hash": "sha256:47e9e3429643105d0eea370e3df0de28df25cad0a2630ef1d5c18b4ec94c562f",
  "content_hash": "sha256:5971bb6e429fd080edc698cad83d913f353f12d657419b7d96b4a10132766ea5",
  "entries": [
    {
      "activity_id": "act-select",
      "scoring_rule": "exact_option_set",
      "correct_option_ids": [
        "not-given"
      ],
      "accepted_texts": [],
      "expected_order": [],
      "expected_pairs": [],
      "integrity_ref": "sha256:356adcf05fa97c34091147127667a20fbe1e8b4f6f2f3ffe81eedf486a038653"
    }
  ]
}
